{
  "testcase_id": "tc4_mixed_history",
  "competition_slug": "icr-identify-age-related-conditions",
  "task_ref": "../task.json",
  "input": {
    "scenario": "mixed",
    "context_action_ids": [
      "CA-000002",
      "CA-000012",
      "CA-000013",
      "CA-000022",
      "CA-000024",
      "CA-000031"
    ]
  }
}
