{
  "testcase_id": "tc4_mixed_history",
  "competition_slug": "restaurant-revenue-prediction",
  "task_ref": "../task.json",
  "input": {
    "scenario": "mixed",
    "context_action_ids": [
      "CA-000002",
      "CA-000004",
      "CA-000006",
      "CA-000007",
      "CA-000011",
      "CA-000024"
    ]
  }
}
