{
  "testcase_id": "tc2_partial_good",
  "competition_slug": "ieee-fraud-detection",
  "task_ref": "../task.json",
  "input": {
    "scenario": "partial_good",
    "context_action_ids": [
      "CA-000005",
      "CA-000010",
      "CA-000020",
      "CA-000025",
      "CA-000030",
      "CA-000071"
    ]
  }
}
