{
  "testcase_id": "tc4_mixed_history",
  "competition_slug": "recruit-restaurant-visitor-forecasting",
  "task_ref": "../task.json",
  "input": {
    "scenario": "mixed",
    "context_action_ids": [
      "CA-000005",
      "CA-000009",
      "CA-000014",
      "CA-000018",
      "CA-000023",
      "CA-000027",
      "CA-000048",
      "CA-000049"
    ]
  }
}
