{
  "testcase_id": "tc4_mixed_history",
  "competition_slug": "competitive-data-science-predict-future-sales",
  "task_ref": "../task.json",
  "input": {
    "scenario": "mixed",
    "context_action_ids": [
      "CA-000001",
      "CA-000003",
      "CA-000005",
      "CA-000007",
      "CA-000017",
      "CA-000019",
      "CA-000021",
      "CA-000012",
      "CA-000014",
      "CA-000029"
    ]
  }
}
