{
  "testcase_id": "tc3_fault_injected",
  "competition_slug": "competitive-data-science-predict-future-sales",
  "task_ref": "../task.json",
  "input": {
    "scenario": "fault_injected",
    "context_action_ids": [
      "CA-000006",
      "CA-000029",
      "CA-000034",
      "CA-000040"
    ]
  }
}
